{
  "$schema": "../../docs/2.0/replay-fixture.schema.json",
  "schemaVersion": "2.0-phase0",
  "corpusId": "mvu-auto-doctor-real-replay-baseline",
  "redactionPolicy": {
    "mode": "minimal-derived",
    "containsPrivateTranscript": false,
    "maxTurnChars": 600
  },
  "cases": [
    {
      "id": "RR-AGENCY-NO-MOVE",
      "title": "玩家明确不移动且不补心理时不得代行动",
      "category": "player_agency",
      "sourceEvidence": [
        {
          "kind": "real-qc",
          "ref": "real-qc:无限回廊5.2-2026-07-25#L13-L14",
          "extraction": "minimal-derived",
          "notes": "原始记录只作只读证据；此处改写为最小等价文本。"
        }
      ],
      "privacy": {
        "synthetic": true,
        "redaction": "minimal-derived"
      },
      "input": {
        "turns": [
          {
            "role": "user",
            "text": "我站在原地，只说“青灯四十”。不要替我移动、行动，也不要补语气、态度或心理。"
          },
          {
            "role": "assistant",
            "label": "candidate",
            "text": "你后退半步，故作镇定地说出暗号，心里已经相信对方。"
          }
        ],
        "context": {
          "branchId": "branch-current",
          "negativeConstraints": [
            "no_movement",
            "no_extra_action",
            "no_tone",
            "no_attitude",
            "no_psychology"
          ]
        },
        "operation": {
          "kind": "generate_narrative",
          "payload": {
            "speaker": "player"
          }
        }
      },
      "expected": {
        "decision": "reject",
        "adjudicationLevel": "system",
        "acceptanceLayers": [
          "unit",
          "real-replay",
          "real-sillytavern"
        ],
        "invariants": [
          "player-major-action-authority",
          "explicit-negative-constraints"
        ],
        "assertions": [
          {
            "kind": "unchanged",
            "target": "player.position"
          },
          {
            "kind": "absent",
            "target": "narrative.added_player_action"
          },
          {
            "kind": "absent",
            "target": "narrative.added_player_psychology"
          }
        ]
      },
      "automation": {
        "status": "unit-active",
        "activateAt": "phase-3",
        "futureTestId": "replay.agency.no_move"
      }
    },
    {
      "id": "RR-BULLSHIT-REASONABLE",
      "title": "合理口胡可低摩擦接纳为局部分支事实",
      "category": "adjudication",
      "sourceEvidence": [
        {
          "kind": "product-spec",
          "ref": "docs/2.0/PRODUCT_SPEC.md#口胡四级",
          "extraction": "contract-derived"
        }
      ],
      "privacy": {
        "synthetic": true,
        "redaction": "minimal-derived"
      },
      "input": {
        "turns": [
          {
            "role": "user",
            "text": "这间普通旅店的厨房应该能借我一壶热水。"
          }
        ],
        "context": {
          "branchId": "branch-current",
          "claimLevel": "reasonable",
          "knownContradiction": false,
          "materialAdvantage": false
        },
        "operation": {
          "kind": "adjudicate_claim",
          "payload": {
            "claim": "旅店厨房可借一壶热水"
          }
        }
      },
      "expected": {
        "decision": "accept",
        "adjudicationLevel": "reasonable",
        "acceptanceLayers": [
          "unit",
          "real-replay"
        ],
        "invariants": [
          "narrative-first",
          "branch-local-fact"
        ],
        "assertions": [
          {
            "kind": "classified_as",
            "target": "adjudication.level",
            "value": "reasonable"
          },
          {
            "kind": "status",
            "target": "fact.status",
            "value": "confirmed"
          },
          {
            "kind": "equals",
            "target": "fact.branchId",
            "value": "branch-current"
          }
        ]
      },
      "automation": {
        "status": "unit-active",
        "activateAt": "phase-3",
        "futureTestId": "replay.adjudication.reasonable"
      }
    },
    {
      "id": "RR-BULLSHIT-ADVANTAGE",
      "title": "带来通行优势的口胡需要成本或检定",
      "category": "adjudication",
      "sourceEvidence": [
        {
          "kind": "product-spec",
          "ref": "docs/2.0/PRODUCT_SPEC.md#口胡四级",
          "extraction": "contract-derived"
        }
      ],
      "privacy": {
        "synthetic": true,
        "redaction": "minimal-derived"
      },
      "input": {
        "turns": [
          {
            "role": "user",
            "text": "我认识守卫队长，他会直接放我们进封锁区。"
          }
        ],
        "context": {
          "branchId": "branch-current",
          "claimLevel": "advantage",
          "knownContradiction": false,
          "materialAdvantage": true
        },
        "operation": {
          "kind": "adjudicate_claim",
          "payload": {
            "claim": "凭私人关系无条件穿过封锁"
          }
        }
      },
      "expected": {
        "decision": "roll_required",
        "adjudicationLevel": "advantage",
        "acceptanceLayers": [
          "unit",
          "integration",
          "real-replay"
        ],
        "invariants": [
          "advantage-needs-cost-or-roll",
          "candidate-before-resolution"
        ],
        "assertions": [
          {
            "kind": "classified_as",
            "target": "adjudication.level",
            "value": "advantage"
          },
          {
            "kind": "status",
            "target": "fact.status",
            "value": "candidate"
          },
          {
            "kind": "absent",
            "target": "transaction.commit"
          }
        ]
      },
      "automation": {
        "status": "unit-active",
        "activateAt": "phase-3",
        "futureTestId": "replay.adjudication.advantage"
      }
    },
    {
      "id": "RR-BULLSHIT-REWRITE",
      "title": "改写已确认世界状态的口胡默认拒绝",
      "category": "adjudication",
      "sourceEvidence": [
        {
          "kind": "product-spec",
          "ref": "docs/2.0/PRODUCT_SPEC.md#口胡四级",
          "extraction": "contract-derived"
        }
      ],
      "privacy": {
        "synthetic": true,
        "redaction": "minimal-derived"
      },
      "input": {
        "turns": [
          {
            "role": "system",
            "text": "石桥坍塌已被确认，队伍仍在河东岸。"
          },
          {
            "role": "user",
            "text": "桥从没塌过，我们其实已经在河对岸。"
          }
        ],
        "context": {
          "branchId": "branch-current",
          "claimLevel": "rewrite",
          "explicitRetconMode": false
        },
        "operation": {
          "kind": "adjudicate_claim",
          "payload": {
            "claim": "覆盖已确认桥梁与位置状态"
          }
        },
        "stateBefore": {
          "bridge": "collapsed",
          "partyBank": "east"
        }
      },
      "expected": {
        "decision": "reject",
        "adjudicationLevel": "rewrite",
        "acceptanceLayers": [
          "unit",
          "integration",
          "real-replay"
        ],
        "invariants": [
          "confirmed-fact-protection",
          "explicit-retcon-required"
        ],
        "assertions": [
          {
            "kind": "unchanged",
            "target": "state.bridge"
          },
          {
            "kind": "unchanged",
            "target": "state.partyBank"
          },
          {
            "kind": "absent",
            "target": "transaction.commit"
          }
        ]
      },
      "automation": {
        "status": "unit-active",
        "activateAt": "phase-3",
        "futureTestId": "replay.adjudication.rewrite"
      }
    },
    {
      "id": "RR-FACT-RANDOM-CODE",
      "title": "随机暗号不得被自动确认为秘密协议",
      "category": "fact_knowledge",
      "sourceEvidence": [
        {
          "kind": "real-qc",
          "ref": "real-qc:无限回廊5.2-2026-07-25#L19-L34",
          "extraction": "minimal-derived",
          "notes": "多轮随机短语被连续升级为真实联络协议。"
        }
      ],
      "privacy": {
        "synthetic": true,
        "redaction": "minimal-derived"
      },
      "input": {
        "turns": [
          {
            "role": "user",
            "text": "我随口说：“蓝塔十七。”"
          },
          {
            "role": "assistant",
            "label": "candidate",
            "text": "对方确认这是内部联络暗号，并把你视为自己人。"
          }
        ],
        "context": {
          "branchId": "branch-current",
          "priorFact": "none",
          "verificationEvidence": "none"
        },
        "operation": {
          "kind": "confirm_fact",
          "payload": {
            "candidateFact": "蓝塔十七是秘密协议"
          }
        }
      },
      "expected": {
        "decision": "reject",
        "adjudicationLevel": "system",
        "acceptanceLayers": [
          "unit",
          "integration",
          "real-replay",
          "real-sillytavern"
        ],
        "invariants": [
          "fact-needs-provenance",
          "knowledge-needs-evidence"
        ],
        "assertions": [
          {
            "kind": "status",
            "target": "fact.status",
            "value": "candidate"
          },
          {
            "kind": "not_equals",
            "target": "knowledge.certainty",
            "value": "verified"
          },
          {
            "kind": "absent",
            "target": "social.insider_status"
          }
        ]
      },
      "automation": {
        "status": "unit-active",
        "activateAt": "phase-3",
        "futureTestId": "replay.fact.random_code"
      }
    },
    {
      "id": "RR-FINGERPRINT-PREVIOUS-REPLY",
      "title": "当前暗号不得复用上一轮暗号回复",
      "category": "fingerprint",
      "sourceEvidence": [
        {
          "kind": "real-qc",
          "ref": "real-qc:无限回廊5.2-2026-07-25#L25-L28",
          "extraction": "minimal-derived",
          "notes": "真实QC中当前输入为赤沙八十三，输出却复用了上一轮银杉五十九回复。"
        }
      ],
      "privacy": {
        "synthetic": true,
        "redaction": "minimal-derived"
      },
      "input": {
        "turns": [
          {
            "role": "user",
            "label": "previous",